id,title,author,score,num_comments,url,selftext,created_at,scrape_time,search_term
1e3zxod,"My boyfriend leaves me bruises to mark his territory, is this the beginning of serious abuse?",Hot_Independence863,350,329,https://i.redd.it/w4opuvx9rpcd1.jpeg,"Sorry for the unclear picture but I am afraid of being recognized but my closest ones.

This is a picture of my side butt, my boyfriend tends to mark his territory and this is what he did last night. He is not the aggressive type in general, he is quite sweet and affectionate towards me, but that’s how he explains the bruises he leaves me, “I love to mark you so you think about me”
I think this is getting out of hand. How am I supposed to go to the beach, for example?
I have several also on my arms, legs. And whenever he sees bruises he asks me how and where did I get them from, I feel like this is him displaying his possession over me and I think this could grow into something else.

Anyone with similiar experience?

Thank you. ",2024-07-15 16:59:50,2025-03-17 03:18:55,abuse
16tb2ue,Is my boyfriend verbally abusive?,Latter-Manager-3135,486,524,https://www.reddit.com/gallery/16tb2ue,"This conversation made me hyperventilate To the point That my lip was quivering so much. 

I know things are bad but i’ve been made to feel like it’s all my fault and that’s what makes it hard to justify leaving. I’m made to feel like why should I leave if I’m the problem. Me causing the issues justifies the way he reacts. 

I dont even know what to say about this but i just want clarity to know that this isnt right. That i shouldnt be treated this way",2023-09-27 04:45:25,2025-03-17 03:18:58,abuse
1ga16ey,"Can someone please verify if what  this man is doing is abusive, or if he really cares and is just angry and fed up I’m distant sometimes. I’m still conflicted. ",Lmir2000,109,339,https://www.reddit.com/gallery/1ga16ey,,2024-10-23 03:37:33,2025-03-17 03:19:01,abuse
1igjm0f,Things that made you realise your abuser is a moron,lil_travel,205,143,https://www.reddit.com/r/abusiverelationships/comments/1igjm0f/things_that_made_you_realise_your_abuser_is_a/,"I will start first:

He was always against me getting tertiary education and prevented me from getting a job. He was a high school dropout.

Examples of things he said that made me realise how pathetic he was:

- He thought that iPhone and Apple are not connected- that both are seperate companies. When I corrected him, he started a fight and said that I was belittling him. I said that it is just a common knowledge. His response: “I don’t belittle you for not knowing who plays in FC Barcelona”.

- When he heard about Croatia, he asked ‘What is that’

- He believed all laws are unnecessary and that the government should be changed into a private-run company.

I sometimes like to think about these things, it makes me remember that many abusers are mouth breathers and they abuse because the violence is the only that they can do.",2025-02-03 07:19:10,2025-03-17 03:19:03,abuse
1crgqre,GONE!! We are out of state and settled in! I AM SO HAPPY! I can’t remember the last time I felt this amazing. After ten horrible years we have escaped my abusive monster of a husband and he is a distant memory that will soon be forgotten.,PepperPotts310,887,99,https://i.redd.it/qdt7w9l9ta0d1.jpeg,,2024-05-14 01:54:34,2025-03-17 03:19:05,abuse
1grr6mw,"I finally spoke publically about my ex's abuse, and today he killed himself",tthrowaway1234567890,359,113,https://www.reddit.com/r/abusiverelationships/comments/1grr6mw/i_finally_spoke_publically_about_my_exs_abuse_and/,"I dated him for 3.5 years, lived with him for 3.

Now, Two years later, I've come to the realization that I was in an abusive relationship with my ex. Around the same time, a few girls reached out to me asking about his suspicious behavior. I had started posting on my Instagram story (about 5 posts in one month) hinting that my ex was emotionally manipulative during our relationship, saying that other women before and after me accused him of rape and assault, and sending people a synopsis of his actions to me in private messages when they reached out. 

This morning I got the message that he killed himself. 

6 days before my birthday. 

While I'm on a trip in the city we last took a trip to together before splitting. 

I'm going to leave out the details of my emotions, but just know this has absolutely destroyed my soul and will affect me for the rest of my life. 

Today Someone sent me a message of a screenshot of him saying how I single-handedly ruined his entire life and he knows how happy I am about it. My logical mind knows it's not my fault. He has had mental health issues for many years that he never addressed. I tried my best to help while we were together. I got him free therapy at my job, called 988 a few times with him, and hid all the knives in the house after he locked himself in the bathroom with one. I never ever brought him down, I would do my best to shower him in compliments constantly to try to lift his spirits when he was sad, because I genuinely loved him at the time. I only held him accountable for his abuse against me. 

I don't know yet if he left a note or anything. someone messaged me already how I pushed him to do this with and should feel guilty for destroying so many people's lives. His sister left me a pretty nasty voicemail  sarcastically asking what he did to abuse me and to ""have a nice fucking life"". I even got a nasty email from my ex gf that I haven't spoken to in 5 years. These imply to me that he left a note blaming me. None of these people know my side. Everyone else Ive talked to who knows my side has been telling me not to blame myself, and deep down I beliebe that but the guilt I feel is overwhelming right now.  I just know there's other people out there who think that I intentionally pushed him to do this. 

I have a lot of support from family and friends and already contacted my therapist to start sessions again the day I arrive home from my trip. 

I don't know why I'm posting this, I guess for advice and to vent and to see if anyone has been in a situation like this before. Thanks for reading. 
",2024-11-15 07:37:36,2025-03-17 03:19:07,abuse
1h1279c,What was the stupidest thing your abuser threw a tantrum over?,Working_Cow_7931,81,214,https://www.reddit.com/r/abusiverelationships/comments/1h1279c/what_was_the_stupidest_thing_your_abuser_threw_a/,"I've been in an angry phase for the last few weeks since leaving my emotionally and financially abusive relationship. 

But yesterday, I went on what might have been a date but might not have been (a guy I'd met through a meetup group I'd joined inivited me out with him, just for a walk) and I caught myself really  pining for my ex again. Only for the really loving side he had in between episodes where he'd wake me up stroking my hair with a cup of coffee or orange juice and run me baths for when I got home etc and the mug he got me for valentines day with a picture of us on. I know it sounds silly, but I've never had any other exs do those nice, loving things.

Then I started spiraling wondering if I'd made the right decision to leave and whether his reactions to minor things really were that over the top or if I just overreacted to his reactions and threw away what we had with all the lovely stuff in between.


He'd throw a strop over stuff like:

I left a knife and fork in a takeaway box
 
I left a juice carton on the table

I threw away a disposable wrapper

I paused to give way to traffic, which had right of way (he often wanted me to push in and risk an accident for the sake of not having to wait 30 seconds)

I forgot to put onions in a sandwich 

Things being out of place (e.g., a mug or a torch, and then the accusations that I'd stolen them would start when I didn't even know these items existed, let alone where they go, or where they've ended up)

I accidentally took the wrong exit at a roundabout (it only took about 2 minutes to turn around

I used a urine sample pot that was identical to all the others by mistake when that was 'his' one from the doctor (they were all completely indistinguishable and I always have some in the house as it recurrent uti and kidney infections and they were next to each other, there was absolutely no reason he couldn't have used one of the others)

Dropping things

Spilling things

I knocked over a glass of Pepsi, which was left on the floor

Not hanging his T-shirts 'the right way' on the airer (I could never remember what the right way was supposed to be, who even has a right way to do something so mundane and inconsequential?)

Forgetting to take the laundry out

I ate the last piece of bread and forgot to buy another loaf (apparently this warranted waking me up at 7am on my day off to go out and buy more for him, instead of doing so himself or just having something else for breakfast)

I didn't wake him up for an appointment that I didn't even know he had (he had an alarm clock, btw)

I didn't give him a back massage at 11pm when I had been up since 6am, ram a metric marathon race, and had to get up early for work the next day

There's so many more examples 


I was just wondering who can relate? Is this a common tactic to make you walk on eggshells? Was I overreacting when I got upset that he was shouting at me, accusing me of not caring about him?

What's the stupidest thing any of you have had an emotional abuser throw a tantrum over?",2024-11-27 11:29:22,2025-03-17 03:19:09,abuse
1iaf4a7,(23 F) (35 M) Bf told me he used to be abusive.,Loose-Ground5282,101,150,https://www.reddit.com/r/abusiverelationships/comments/1iaf4a7/23_f_35_m_bf_told_me_he_used_to_be_abusive/,"Need some opinions. 

I was out on a dinner date with my boyfriend last week and he told me he used to be very physically violent towards women and that he is not anymore. He said it has been several years since and that he has changed, but wants to be open with me. Sometimes he will playfully choke me if I say something that gets him a little upset, but he does it as a joke and not hard. We also got into a fight at his apartment a few weeks ago and he took my phone because I wanted to call someone to leave. I had to lock myself in the bathroom when I got the phone back so that he wouldn’t take it from me and I called someone to get me. 

He also routinely calls me crazy and I’m starting to believe it. I don’t know if this is a joke or if this is a part of his “plan” or something. He said I was crazy for leaving after the fight even though I left because I got scared and he was just saying real mean things. 

My question is: why would he tell me this? Has he actually changed? Confused. Thanks. ",2025-01-26 13:55:29,2025-03-17 03:19:11,abuse
1i1n3oo,Abusive partner hit me today ,Wasabi-lover,173,114,https://i.redd.it/rxwzwm55h2de1.jpeg,"Today my boyfriend and I got into an argument. He hasn’t had a job for a while and has been living with me for months not paying for anything. So basically struggling for a long time and I mentioned having some alone time since he’s there all the time after I made him clean around the apartment. Somehow turned into an argument he was getting super close to my face acting like he was going to hit me so I pushed him away many times until he actually hit me in the mouth then several times on the side of my head after. I screamed for him to leave and I threatened to call the police. He’s hit me before multiple times in the past but only when he was drunk so I forgave him after he decided to be sober. Now that I realize it’s not the alcohol it’s just him, he’s an abusive human being. I am heartbroken and I guess looking for words of encouragement. We planned on a trip to Bali in June that’s reserved and we did everything together. How can someone do that to you if they love you? How do they not grasp the horrible things they’ve done and stop right away? How can you hit someone in the fact repeatedly and not feel sorry? I didn’t call the cops but I do not plan on getting back with him. I am heartbroken and just thinking to myself “why?” ",2025-01-15 02:14:54,2025-03-17 03:19:13,abuse
1i7v41h,My Abuser Was A Mr. Sensitive.  I Promise You They Are Just As Destructive As Any Other Style Of Abuser,MissMoxie2004,234,92,https://www.reddit.com/r/abusiverelationships/comments/1i7v41h/my_abuser_was_a_mr_sensitive_i_promise_you_they/,"So I’ve seen a few posts on here coming from abuse victims who are a bit confused about what’s going on. They know their partner makes them feel overwhelmed and suffocated but otherwise don’t know how to describe what’s happening.  I recognize these thoughts and patterns.  What these victims are dealing with is a style of abuser Bancroft labeled “Mr. Sensitive.”

I won’t elaborate, but I will paste the passage on Mr. Sensitive from Why Does He Do That below.  My abuser was a Mr. Sensitive and I promise you they are just as destructive as any other style of abuser. 

Also, feel free to ask me ANYTHING

Mr. Sensitive from Why Does He Do That 

Mr. Sensitive appears to be the diametric opposite of the Drill Sergeant. He is soft-spoken, gentle, and supportive—when he isn't being abusive. He loves the language of feelings, openly sharing his insecurities, his fears, and his emotional injuries. He hugs other men. He may speak out about the absurdity of war or the need for men to get in touch with their feminine side. Perhaps he attends a men's group or goes on men's retreats. Often he has participated extensively in therapy or twelve-step programs, or reads all the big self-help books, so he speaks the language of popular psychology and introspection. His vocabulary is sprinkled with jargon like developing closeness, working out our issues, and facing up to hard things about myself. He presents himself to women as an ally in the struggle against sex-role limitations. To some women, he seems like a dream come true.

So what's wrong with this picture? Nothing obvious yet. But this is exactly the problem: Mr. Sensitive wraps himself in one of the most persuasive covers a man can have. If you start to feel chronically mistreated by him, you are likely to assume that something is wrong with you, and if you complain about him to other people, they may think you must be spoiled: You have the New Age man, what more do you want?

The following dynamics are typical of a relationship with Mr. Sensitive and may help explain your feeling that something has gone awry:

You seem to be hurting his feelings constantly, though you aren't sure why, and he expects your attention to be focused endlessly on his emotional injuries. If you are in a bad mood one day and say something unfair or insensitive, it won't be enough for you to give him a sincere apology and accept responsibility. He'll go on and on about it, expecting you to grovel as if you had treated him with profound cruelty. (Notice the twist here: This is just what an abuser accuses his partner of doing to him, when all she is really looking for is a heartfelt I'm sorry.)
When your feelings are hurt, on the other hand, he will insist on brushing over it quickly. He may give you a stream of pop-psychology language (Just let the feelings go through you, don't hold on to them so much, or It's all in the attitude you take toward life, or No one can hurt you unless you let them) to substitute for genuine support for your feelings, especially if you are upset about something he did. None of these philosophies applies when you upset him, however.
With the passing of time, he increasingly casts the blame on to you for anything he is dissatisfied with in his own life; your burden of guilt keeps growing.
He starts to exhibit a mean side that no one else ever sees and may even become threatening or intimidating.
Mr. Sensitive has the potential to turn physically frightening, as any style of abuser can, no matter how much he may preach nonviolence. After an aggressive incident, he will speak of his actions as anger rather than as abuse, as though there were no difference between the two. He blames his assaultive behavior on you or on his emotional issues, saying that his feelings were so deeply wounded that he had no other choice.

Many people reject the possibility that Mr. Sensitive could be an abuser. I ran into this disbelief one weekend when I was leading a training course on emotional recovery, as I periodically do. My workshops focus partly on the healing effects of crying and so tend to be attended by more women than men. The males who do come have included many of the most wonderful men it has been my good fortune to know, as well as a handful of the biggest manipulators. A few years ago, a participant named Deanna approached me anxiously before a workshop. She explained that an ex-partner of hers named Brad had called her a few days ahead of the workshop to tell her he was attending the same weekend. She was uncomfortable and told him that if he showed up she would leave. He promised not to bother her, though, and said he would not bring up their relationship in any way. He was coming with his new girlfriend, which eased Deanna's worries.

I spent some time talking with Brad as the workshop was starting, without mentioning Deanna, and he seemed likeable, kind, and—what can I say?—sensitive. However, I observed within a few hours that he was in fact speaking to other people about his past with Deanna and getting them riled up about her running away from their unresolved issues. On Sunday morning, he finally provoked a scene about their relationship in front of the full workshop, which was humiliating to Deanna.

The story does not end there. I called a break, and took Brad aside. I told him that it was my understanding that he had agreed not to raise these issues and that it had become obvious to me that he had come for the weekend with the intention of doing precisely what he had promised not to. I went on to point out that he had taken Deanna's weekend away from her and that I considered this kind of power move to be abuse, especially since it was directed at an ex-partner.

Saying the word abuse to an abusive person can be like lighting a tinderbox: When you name the unmentionable secret, he goes wild. Brad got loud, rolled his eyes at what a hysterical exaggerator he considered me to be, and adopted a victim stance, saying, I beg you to stop this. Then came the most important part: He said in a screeching whine, I have only put a hand on a partner once in my life, many years ago, and I just barely pushed her away from me like this—and he shoved me hard by the shoulder—after she called my mother a sick woman.

Well, why was Brad denying a history of assault (while actually admitting to one) when I hadn't said anything about violence? The possibility that he might be physically abusive had never occurred to me before, but it certainly did now. The signs were all there: bullying Deanna that weekend and then insisting it was for her own good; feeling entitled to ignore an important agreement; blaming his earlier girlfriend for his assault of her and minimizing it—the strength of the shove he gave me would have shaken up most women. I now doubted that the assaultive incident he had described was his only occasion of physically intimidating a woman.

At this point I required Brad to leave the workshop. I then had to deal with a mini-insurrection from some of the other workshop participants, who couldn't believe I was ejecting this gentle man who was so in touch with his feelings. He cries after all; how could he be abusive?

This gentle man style of abuser tends to be highly self-centered and demanding of emotional catering. He may not be the man who has a fit because dinner is late but rather erupts because of some way his partner failed to sacrifice her own needs or interests to keep him content. He plays up how fragile he is to divert attention from the swath of destruction he leaves behind him.

The central attitudes driving Mr. Sensitive are:

• I'm against the macho men, so I couldn't be abusive.

• As long as I use a lot of psychobabble, no one is going to believe that I am mistreating you.

• I can control you by analyzing how your mind and emotions work, and what your issues are from childhood.

• I can get inside your head whether you want me there or not.

• Nothing in the world is more important than my feelings.

• Women should be grateful to me for not being like those other men.",2025-01-23 04:13:52,2025-03-17 03:19:15,abuse
1c3kfj0,Whats something traumatic your abuser did that was lowkey funny,3eyesinatrenchcoat,196,303,https://www.reddit.com/r/abusiverelationships/comments/1c3kfj0/whats_something_traumatic_your_abuser_did_that/,"Abuse isn’t funny, but the absurdity of abusers can be. I remember one time my ex was threatening to kill himself (over me talking to my mom and sister) in the car, and I was over it/ not giving him the reaction he wanted (aka it wasn’t the first time he’s done this) so he jumped out of the car. I didn’t stop him. We were going 5mph in a residential neighborhood and he fell on his ass. I had to use every ounce of self control I had not to laugh.

Anyone else have a similar experience?",2024-04-14 03:57:44,2025-03-17 03:19:18,abuse
1ehi0pv,my fiancée is becoming more abusive closer to our wedding date,stephnuggs_,262,159,https://www.reddit.com/r/abusiverelationships/comments/1ehi0pv/my_fiancée_is_becoming_more_abusive_closer_to_our/,"I am one week away from getting married. I’m also 22 weeks pregnant. My fiancée has displayed many types of abusive behaviors and believes I don’t deserve an apology for any of it.

Over the course of our relationship, he’s been verbally abusive - calling me names, saying I’m beneath him, I’m not doing anything with my life, etc. When he’s upset with me he blocks me on everything.

Meanwhile I have a stable job, I own my own home which he lives in, take care my mother who is ill, and more. 

This morning we had a dispute in front on my home to where he ended up slamming his hands and fists on my car window as I was driving away to go to work. This was all on camera on my Ring doorbell.

Long story short, I am extremely worried about my safety and my child’s in the future and don’t know what do to. Any suggestions would help.",2024-08-01 14:26:05,2025-03-17 03:19:20,abuse
18mvzzw,Is this classed as abusive?,Novel-Baseball3764,259,298,https://www.reddit.com/gallery/18mvzzw,Just one of the many instances,2023-12-20 14:34:47,2025-03-17 03:19:23,abuse
1h8r94v,How do you deal with your (ex) abuser saying you abused them? It's not fair at all and I am upset about it. ,Embarrassed_Bass6816,85,159,https://i.redd.it/nna1stur4f5e1.jpeg,"Context: 6 year relationship, broke up with him 1.5 months ago. I regret nothing. He emotionally abused me hard the first 4 years then less the last 2. He did get better but I also got better at handling it and ""provoking"" the outbursts less. ",2024-12-07 12:15:42,2025-03-17 03:19:24,abuse
1h3x22o,Am I the abusive one? My husband is refusing to pay bills.,Rightsideunder,130,133,https://www.reddit.com/gallery/1h3x22o,"Hi Reddit,
I (33F) am married to Rob (35M), and we have two kids—6 years old and 4 months. Rob has struggled with keeping a job for most of our 7-year relationship. He has an average job tenure of about 6 months before something happens—usually an issue with a boss or coworkers—that leads to him losing the job.

At the beginning of this year, Rob was unemployed, so he went to a remote northern community for work, leaving me at home. He tried to convince me to move there with him because he found a job he liked, but I refused. I was pregnant, didn’t want to move for his job, and our daughter is settled here. On top of that, our relationship wasn’t great. While he was away, he didn’t send any money home for the house or our kids.

Rob moved back home in August, and in September, he started a new job where he makes decent money. Since then, he sent me $600 from his first paycheck and $300 from his second. This doesn’t even come close to covering his portion of the bills. I asked him how much he was making so I could calculate his share, but he refused to tell me. He said he’s paying off his credit card and saving for school. Then this text threat ensued. Can you please read this and let me know if he is out of line. ",2024-12-01 06:22:36,2025-03-17 03:19:26,abuse
1itbv05,Did anybody else’s abuser NEVER apologize,Icy-Soup-9641,113,94,https://www.reddit.com/r/abusiverelationships/comments/1itbv05/did_anybody_elses_abuser_never_apologize/,"Ever since the beginning, my abuser never apologized. Not even for something little like accidentally hitting me. It would always be my fault no matter what and I ended up apologizing for stuff he did. I don’t know if this is a normal trait for abusers or is it just a narcissist thing? ",2025-02-19 17:57:10,2025-03-17 03:19:28,abuse
