id,title,author,score,num_comments,url,selftext,created_at,scrape_time,search_term
ej4j4s,"Stalking Awareness Month. The deadly intersection of stalking and domestic violence is well-documented. Stalking is a form of DV & can lead to death. Want to break the silence- stalking isn’t talked much about on reddit. Stay aware, speak up, share your story & stay safe. #stalkingstealslives",lilmizsunshine092,132,10,https://i.redd.it/lgut6wk5nf841.jpg,,2020-01-02 21:22:47,2025-03-17 03:33:42,domestic violence
ufpr08,Am I a victim of Domestic Violence even if I've never been hit?,Julz513,11,6,https://www.reddit.com/r/abusiverelationships/comments/ufpr08/am_i_a_victim_of_domestic_violence_even_if_ive/,"I read what I guess was an thought provoking, eye opening article. I believe my boyfriend is mentally and emotionally abusive. 

He is hypercritical. Tells me I am raising my children wrong, and they will stay ""babies"" and ""dependent on me."" He yells at me, putting me down, telling me I can't manage my money. He frequently gets super annoyed with me for being ""lazy"" because I didn't run the roomba, mop the floors, clean the bathroom and otherwise engage my time productively. Instead, I played games on my phone and watched TV WHEN I wasn't taking care of/shuttling my children around to counseling, occupational therapy, soccer practice, etc. 

I don't work BECAUSE OF my 2 special needs children. One of children only goes to school right now until 11:30a. Plus they have all the above appts. I, too, have lots of appts. bc I have mental and physical health issues. 

He will give me a hard time about those, too, telling me I need to lose weight, that I need to take better care of myself. 

My boyfriend has a history of DV. He had to take anger management and DV classes 7 years ago when his son was removed by CPS/DCFS. He failed to reunify bc of his issues despite finishing the classes. 

His son's mom reunified; however she committed suicide last September and now my boyfriend is trying to reunify with his son a second time. It's added a lot of stress. 

I thought I wasn't a victim of DV because he wasn't hitting me...the way he did his previous baby moms. As far as I know, he's had no physical DV in 7 years. I thought he'd had none. But...thinking about past girlfriends, and then now my situation...DV can be more than just physical, I guess, right?",2022-05-01 02:10:51,2025-03-17 03:33:44,domestic violence
hnoh59,MOD Post Wednesday: Resources for Domestic Violence & Pet Abuse,Ebbie45,160,4,https://i.redd.it/xi4uri40uo951.jpg,,2020-07-08 20:09:03,2025-03-17 03:33:45,domestic violence
tupg90,What should you do if you see a stranger in a domestic violence situation?,throwaway56gh61,5,3,https://www.reddit.com/r/abusiverelationships/comments/tupg90/what_should_you_do_if_you_see_a_stranger_in_a/,"Basically, the only thing im not sure about is if I should call the cops or something. This happened last night. I'm a domestic violence survivor so I take this very seriously but i am also very understanding/sympathetic to the victims perspective. Last night I ubered back to the hotel very intoxicated. I stepped outside to smoke a cigarette and heard someone out on the lawn of the hotel yelling so I walked closer and realised there was a woman yelling ""get your fucking hands off me"" and she was fighting with her boy friend. There was another man outside who walked up at the same time and and he and I basically just started yelling at the guy and he stopped and walked away and the woman walked to me. The other guy who intervened walked away and the girl and I went to the pool to talk. She made excuses that he doesnt drink often and only gets this way when he drinks. She made some more excuses and just maintained that she loved him more than anything and that she'll punch him right back, she was very fit and said she could take care of herself. But we all know those are just excuses. She and I sat together for about an hour talking, first about the situation and then just about anything. Her boy friend periodically would come around and walk near the pool and she told me to just ignore him. I feel like I should have called the cops but as I survivor myself having the cops called never really made a difference. I feel like I did nothing to help her except for be there for her emotionally but i'm not sure what I could have done. Does any one ahve advice on this situation? Or maybe something i can do in the future? I may see her again at the hotel, what should I do?",2022-04-02 18:18:57,2025-03-17 03:33:46,domestic violence
pzx7xa,Domestic Violence SOS,vibrant_soul,4,7,https://www.reddit.com/r/abusiverelationships/comments/pzx7xa/domestic_violence_sos/,"

My close friend is in an extremely abusive relationship. Her boyfriend has purposely put her in debt with her apartment complex by not paying his half of then rent when he is mad, he is not in the lease and claims he has squatters rights. Now she’s swimming in debt and late fees to the apartment. She is now pregnant and having high risk pregnancy with a heart condition that keeps her from working. The police here in Florida won’t help her because she hasn’t changed her tags and license over from her home state, and told her if she called them again they would take her to jail even though they arrived to her having a bloody nose and bruising to her face. They did not take him to jail. He takes her apartment key when he leaves so she can’t leave or she won’t be able to get back into her home. He calls her names everyday and has told her she should have an abortion on multiple occasions. He’s gone as far as threatening to hire someone to kill her. She needs help as he has cut her off from all resources and family help. He refuses to leave her apartment and threatens legal action against her if she tries to lock him out. Any suggestions or resources are greatly appreciated.",2021-10-02 15:24:04,2025-03-17 03:33:47,domestic violence
1io8oay,"Coping with being ""date"" raped by my spouse?",princessmouseskin,109,60,https://www.reddit.com/r/abusiverelationships/comments/1io8oay/coping_with_being_date_raped_by_my_spouse/,"Does anyone have experience recovering from martial rape? My husband raped me be a few times during our over a decade long marriage. All were while I was awake, however, one time I'm very certain was after him drugging me. I woke up hours later than usual, wearing pajamas I don't wear to bed, sore and covered in cum. I freaked out and asked him what happened and threatened to move out. He wouldn't acknowledge anything, said he wouldn't even know where to get such drugs, and couldn't bother to look away from his phone. He was annoyed I slept so long. The sleep was much later for me than normal. I went to the bathroom afterwards to shower and choose to believe him instead of uproot our lives.  We've been separated for almost a year now and this memory hit me so hard. I'm worried that he did it more than once, especially since he admitted to recording me sexually without my knowledge in the past. I want to move on as I'm free from him, but how do I trust someone, or even myself again? Especially with no proof than my memory? Thanks for the input.",2025-02-13 02:21:13,2025-03-17 03:33:49,domestic violence
yc6893,Wow…this was a response I got on another subreddit 🥴,hallowqueen93,430,205,https://i.redd.it/5n71ub51xpv91.jpg,,2022-10-24 08:55:13,2025-03-17 03:33:51,domestic violence
v5724z,"called the domestic violence line, can't stop shaking now.",HopelessResearcher,6,0,https://www.reddit.com/r/abusiverelationships/comments/v5724z/called_the_domestic_violence_line_cant_stop/,"Had a chat with a social worker, told her about some of the things that he did and still doing to me and now I can't stop shaking. It feels like some of  those old memories have returned and now I'm feeling scared. Also I have just realised that he might have tried to strangle me a bit a few years ago when he put his hands on my throat when I tried to stop him from abusing our baby. Now I'm wondering what other things he might have done to me in the past that I have forgotten about.",2022-06-05 05:55:00,2025-03-17 03:33:52,domestic violence
s3m1yl,Domestic violence?,i_cant_zombie,3,3,https://www.reddit.com/r/abusiverelationships/comments/s3m1yl/domestic_violence/,"My husband and I have been married for 9 years and have a 6 year old - T. We both had physical and mental health issues before we met and those things have always been a part of our relationship.

Over the few years my husband’s anger and depression have gotten worse. It was greatly impacting all of us and I reached a breaking point and asked him to move out for a while so he could focus on his health. And so our son and I could have a more predictable routine and less drama. So, he went to stay at his parent’s house just after Christmas.

Since he moved out, he has spent time with our son T and T loves spending time with his dad. But on the two occasions when all 3 of us spent time together at our home, he had major angry outbursts including punching a take out container and sending food flying, breaking a plastic storage box, throwing toys, punching cabinets etc and screaming. 

In both cases, I took our T upstairs and waited for my husband to calm down and then I asked him to leave. He refused to leave. I wanted to latch the interior lock on the door and go to bed, but he wouldn’t go. I talked about how we needed this to be a safe/stable space for T and this behavior was not ok around me or our son. He eventually left, but on his terms.

My individual therapist characterized this behavior as a form of domestic violence. I was surprised to hear that term associated with this and I’m overwhelmed by it.

When my husband and I talked about these episodes, he minimized them, said his behavior wasn’t that big of a deal and that if I was so upset by it maybe I needed more mental health support and that maybe he should live here with our son so I could take care of my needs. 

So basically my therapist is on one end of the spectrum in her classification of this and he is on the other. 

Am I overreacting? Is my therapist’s opinion on this too extreme?",2022-01-14 07:01:54,2025-03-17 03:33:53,domestic violence
t2ahqk,My emotionally and verbally abusive wife called the cops on me for domestic violence.,throwaway31223954,3,2,https://www.reddit.com/r/abusiverelationships/comments/t2ahqk/my_emotionally_and_verbally_abusive_wife_called/,"The case was dropped because of her threatening text messages. Her and her family have been going around lying about me and calling me abusive and it’s all BS. They are doing this to paint me as some monster so that their daughter can get remarried probably an arranged marriage even. It’s like no one cares that she had been hurting me for months with her text messages and yelling at me.

I feel so hopeless. My therapist is only slightly helping me but not by much…",2022-02-26 23:47:04,2025-03-17 03:33:54,domestic violence
u72dtm,Transportation Help for Domestic Violence Victims,ImLeavingYouBehind,10,0,https://www.reddit.com/r/abusiverelationships/comments/u72dtm/transportation_help_for_domestic_violence_victims/,"A lot of people have been asking about help with airfare, buses, cars and general transportation costs lately. I found a few resources and thought I would share. I have not used these but they look to be helpful.

This foundation offers assistance with transportation costs (I think anywhere in the US, but call to be sure). Their site specifically mentions paying for bus fare, train tickets, airfare and travel expenses. https://www.themilliganfoundation.org/history

Angel Flight and Mercy Flight offer free flights to victims of domestic abuse. Here's the list of websites by region: https://aircharitynetwork.org/request-a-flight/

Also, consider calling your local crisis center and asking about a grant for your transportation. They may be able to pay for a ticket.

Lastly, Uber has a program called Driving Change and they will give free rides to domestic violence victims. Just call your local shelter and ask for a voucher. If they participate in the program they will give you a voucher/code for a free ride.

If you know of other programs let us all know!",2022-04-19 10:57:16,2025-03-17 03:33:55,domestic violence
qpy95e,my parents are in a toxic relationship. i think my dad has been abusive and i want my mom to leave. TW: domestic violence,Alarmed_Nobody_9259,13,3,https://www.reddit.com/r/abusiverelationships/comments/qpy95e/my_parents_are_in_a_toxic_relationship_i_think_my/,"hey so i’ve been trying to deal with this for a while but i just can’t decide what to do by myself and i have no one to turn to, so i’m here to ask for help. i’m sorry if this is too long to read, but a lot of things are unclear to me and i really don’t know what to do.

i’m 17 and the oldest of 5 kids. my parents are married and usually never fight, so i’ve always admired their relationship. about two months ago my mom asked me to help her delete some stuff off her phone as she was running out of storage. when I unlocked the phone, this email account was open and all messages had dates as subjects. I never should’ve clicked on them but I just did. every single email had several attachments, screenshots of different conversations between my dad and other women. most of them where he was clearly flirting with them, others where they talked trash about my mom saying she “is always with the kids” and “always complains”, and even some sexting conversations that I thankfully did not open.

anyway, i had about three weeks where all i could think about were those emails and i cried almost every single day. about a month ago, my mom bought a new phone and she asked me to help her clear her notes and files so she could transfer the things she needed only. when cleaning her notes app i noticed that apart from the regular supermarket lists and stuff, she used them as a diary of some sort, where she wrote messages as if they were directed to my dad (the most recent ones from july-aug from this year).

basically she just wrote long descriptions of everything she found out, saying how she felt and even describing how tired she is of taking care of my siblings and i every single day and having to live by his empty promises of changing. i’m trying to make this as short as i can, but lets just say i also found out he got with one of his students when he was a teacher a few years ago, and had been consistently sending money to many of those women. other disgusting things were written and mentioned, but i really had it when i read that in one of the notes she said something along the lines of her not even realizing where he hit her. 

finding out my dad was this completely different person still feels like someone stabbed me. i feel so so bad for my mom and i just don’t know how to help her. one note specifically she wrote saying how she had been thinking about how she would manage with us 5 by herself. and another one saying how she stays with him because he promised her to change, and how she is afraid to leave him, because she loves him, because all income comes from him, and because he has a really good reputation around town.

i keep thinking about the way i always looked up to him and how he turned out to be this way. it really hurts when i think about how i like the music i like because he likes it, i like cars because he does, i watch and talk sports with him, and i’ve always taken pride in calling him my father. and it feels wrong to be worrying about what i feel when my mom has been through all of this. i don’t feel safe here anymore, i can barely sleep at night knowing what he’s done and worrying for my mom. i worry for my siblings and i want to keep them away from this so bad.

i’m so sorry this post is such a mess but i just can’t do it anymore, i’ve wanted to talked to my mom about it because that seems to be my only option, but her mom (my grandma) has been struggling with health issues and we think she may pass soon, so i don’t feel it’s the right moment to tell her, she is stressed enough and me telling her i know all of this will only worry her more. i don’t have any other option because talking to anyone i know means they know my dad, and i don’t feel it’s appropriate to talk about anything before i talk about it with my mom, after all she’s been keeping it a secret for years apparently. i fully respect what my mom wants, but i would want her to leave my dad, and even if i do get that its hard because she loves him more than anything, i feel she is putting not only herself but me and my siblings in danger by staying. i feel it’s also important to mention that my dad is a heavy drinker and while he doesn’t drink that much daily, he has had some specific moments where it has been an issue.

i’ve thought about it ever since i found out and decided that i will do whatever it takes to keep my siblings safe, even if it means i’ll eventually have to move out and have them live with me. also, doing anything about the situation would mean we have to discuss the “why” with them, and i don’t know if i want them to know what kind of person my dad really is. it hurt enough when i found out and its not something i want them to go through.

ps. I want to add that on my sister’s birthday this year a few months ago (april i think) she had a party, and when all her friends were leaving I heard my parents fighting. the yelling was pretty loud and they usually never fight (and if they do they never yell like that), my sister had to ask her friends to go on a walk around the neighborhood with her so they didn’t hear the fight and their yelling eventually ended on what I thought was a loud thud noise against some furniture. i asked my mom about it some time later that month but she said nothing happened. obviously after all of this i can only assume he hit her, but i’m not sure if this is what she was talking about in that note or if he’s done it again.

another ps. sorry for any mistakes, english is not my first language.",2021-11-09 07:11:12,2025-03-17 03:33:57,domestic violence
prdqkt,Fled domestic violence and living in a tent and need advice,throwawayguuurl,5,3,https://www.reddit.com/r/abusiverelationships/comments/prdqkt/fled_domestic_violence_and_living_in_a_tent_and/,"As the title says, I've fled domestic violence and I'm going to be living in a tent. It will sound weird but the only other place I had to go was a friend of my ex's mom. Unfortunately he has dementia and he yells at me constantly and tries to grope me. In fact he already tried to hold me down once. I'm disabled and I'm worried that if I stay there he's going to end up raping me because I can't fight him off. He's basically said let it happen because I'm not hurting you.

I know it's going to sound like I'm being entitled but he flips on the lights and the TV in the middle of the night and I can't sleep. I've already applied for disability but that's the process and I've applied for housing but none of the places are taking applications due to covid and they said that even when they do open back up which they don't even know when that will be, there's a six-month wait. I just can't live this way anymore. I didn't leave my abuser just to have to deal with this so I would honestly rather just being a tent.

I've already called The Domestic Violence Shelter here and they are full to capacity. I'm in Jacksonville Florida and I just need advice on where to pitch this thing where nobody will mess with me especially the cops. I don't want to end up in jail due to fleeing domestic violence. Any advice is appreciated.",2021-09-19 18:40:44,2025-03-17 03:33:58,domestic violence
lnxygi,Domestic Violence Survivor - Best Friend Currently Dating an Abuser - Advice please,diff4544,2,7,https://www.reddit.com/r/abusiverelationships/comments/lnxygi/domestic_violence_survivor_best_friend_currently/,"Hey everyone!

Ive been a long time reader - first time poster. I really need an opinion from people i dont know about my current situation.

My friend and I have known each other for about 5 years. We have been inseparable (not necessarily in the sense of seeing each other every day etc) but we were very close emotionally and mentally. We could tell each other anything etc.

For background: i was in an incredibly violent domestic violence situation approx 6+ years ago, it lasted for about 5 years. It was extreme. There were a few times where my abuser almost killed me. I feared for my life when i was finally able to break away - and i had extreme PTSD and anxiety because of this relationship - which i received therapy for (still am in therapy and also on medication). My life has done a complete 180 - i am very healthy, happy, almost finished with my degree. im in a very healthy and loving relationship.

My friend a handful of months ago met this man and at first i was beyond excited and happy for her. Suddenly and very quickly things took a turn. It started very subtle - but as a domestic violence survivor - many of us can spot these signs quicker than most. He would say things to her like: you are so cute - i can see that the wheels are turning and no ones home its fun to watch. Now, most people wouldn't freak out over it nor did i, but i did warn her: this isnt something necessarily nice and maybe you should keep an eye on it. She stated she thought it was cute - okay, i disagree but moving on. She set up boundaries very respectfully and quickly with him: im not going to be ready for sex for x amount of time nothing to do with you this is just my thing etc. He went on to say: im really fucking offended that you would think that im just trying to fuck you. I explained: hes trying to guilt you into sex - dont ever apologize to someone for putting up a boundary for yourself. She apologized to him - said she didnt think hed take it personally. (I explained there was no reason for him to - she disagreed). She goes to his house for the first time approx date 3-4 they mess around she explains im not ready to go all the way - he asked her about 5 times to have sex with him - She kept having to say no - i stated it was unacceptable behavior and urged her to get a reality check - she said she essentially thinks its cute that hes so into her - and that he: ""has a chip on his shoulder but she finds it really sweet"" Basically, this man has forced her to have sex with him and that is a truth that she is not ready or willing to face.

\*\* Also have begun to notice: we are both college students - she has let her schooling slip severely to spend time with him which is a giant red flag to me - for example they went on a trip for valentines weekend - and she did none of her work which is very unlike her and now shes behind and struggling in her classes\*\*

The issue between us: she asked me for my opinion on this guy and i stated that i didnt like him at all, he gave me the creeps, i dont think hes a good person, i have a horrible feeling about him etc. Immediately she started to attack me, my boyfriend, my relationship etc. So it created a wedge between us and i met her to discuss it in person: dont ever disrespect me again; i will support you but i dont like him. She smiled and nodded and ever since there has been an extreme amount of tension and animosity most of which i could ignore until recently she started in with the topic of abusive relationships. Celebrity men being outed as abusers has been the topic of focus - a topic we once saw eye to eye on and now shes got this attitude of: i think its weird that you dont feel sorry for these men, i mean if they had a horrible childhood thats a good excuse to me for why they end up the way they did. etc. things to just really seemingly get under my skin and trigger me.

I have begun to get really triggered and have flashbacks about my abuse that took years of therapy for me to work through. I expressed this to her - and stated while i dont blame him; he is bringing out a part of her that is the worst part of her and ultimately SHE is doing these things to me and i need them to stop. She stated that she disagreed with everything i said, stuck up for him essentially (was not expecting her not to for the record) and when on to say: honestly, i forget half the time that youre a domestic violence survivor - my bad.

I really love her like a sister - we have been friends as i said for years and our children are growing up together (we each have a child) and im worried for her - i know that i cant control her life or decisions no matter how clearly i can see them and she cannot - but i can control my own life. I recognize that her behavior is toxic and triggering for me - but i cant help feel this sense of guilt for wanting to turn my back on her. I dont really want to do that at all. When i was with my abuser a lot of people did it to me and i did understand why and continue to but it hurt and it was a very lonely place to be. But for my own mental health - i cannot be in the presence of a man like this nor is it easy for me to watch my friend change for a man like this. I guess i wanted to share my story and see what you guys would do in this situation? Thank you in advance.",2021-02-20 03:20:33,2025-03-17 03:33:59,domestic violence
