id,title,author,score,num_comments,url,selftext,created_at,scrape_time,search_term
16eelb4,HELP: What do you think of my BF (34M) and I’s (23F) conversation?,Aggravating-Coach855,79,270,https://www.reddit.com/r/abusiverelationships/comments/16eelb4/help_what_do_you_think_of_my_bf_34m_and_is_23f/,"Update: I ended all communication with him for good 3 weeks ago! 


*Edit: The reason I’ve stayed is because we broke up for 1 month a little over 2 months ago and didn’t talk at all during that month. However, he ended up reaching back out to say that he didn’t realize how in love with me he was and how he wanted to commit to being a good boyfriend to me and how he didn’t realize how good he had it blah blah blah and so we reconnected and then it went right back to the hot and cold/wishy washy stuff and now he says, “I said I loved you, not that I was IN love with you,” even though he 100% had said he was IN love with me on the phone call when he reached back out.*

I posted this in another forum and was told I should check this one out as well so I’m posting here too to get opinions. I don’t think he is being abusive, but rather straightforward and honest. I would also love to have the opinions of males so I can see it from their perspective.

My bf (M34) and I (F23) had a conversation tonight and I just feel empty with this deep, deep sadness inside. I need people to wake me up with their interpretation of it and their advice because I feel like I’m so blinded by my love for this man that I’m not seeing the damage I’ll do to myself long-term. 

Here is the conversation:

Me: Do you want me here? 

Him: I don’t want to end things. It won’t be me that puts an end to this.

Me: So do you want me here?

Him: I don’t care. You’re not going anywhere. You haven’t for a year.

Me: What is the point of having me here then?

Him: I feel like I didn’t choose you. I feel like I’m stuck with you. 

Me: Would you want your daughter to stay with someone like that?

Him: I think there is a pretty obvious answer to that. No. And if she wants to be dumb, then she better be strong. 

Me: Why would you want to be with someone you don’t love?

Him: Once you understand that men don’t get to marry the woman he falls in love with, but the woman that stays, then you’ll understand. We don’t get to marry the woman we love. 

Me: Why don’t you love me?

Him: There isn’t anything wrong with you. We just aren’t compatible. The things I find disrespectful, you are just completely oblivious to and don’t give a fuck. And the things you find most important, I think are stupid. 

Me: Do you think I could make you happy?

Him: I don’t think I’LL be able to make you happy. I don’t care if you make me happy because happiness isn’t that important to me. And I take back the last thing that I said about me not being *able* to make you happy. I don’t think I’ll ever make you happy because I don’t care about making you happy.",2023-09-09 19:36:38,2025-03-17 03:27:21,help
10zoh8o,Help me figure out if this is a red flag or just creepy.,Thathuman40301,155,217,https://www.reddit.com/gallery/10zoh8o,,2023-02-11 14:09:20,2025-03-17 03:27:27,help
1hp55sq,I thought ending abusive relationships was supposed to help you.,decaying_doll94,71,48,https://www.reddit.com/r/abusiverelationships/comments/1hp55sq/i_thought_ending_abusive_relationships_was/,I've never felt more alone without him. I don't have family or friends anymore. And I don't have a personality anymore. All I can remember was the side of him that made me want to forget everyone. Now life is unbearable and beyond loneliness. I thought being alone was better than being punched. It. Isn't.,2024-12-29 20:36:15,2025-03-17 03:27:28,help
1hu24bh,"I just left and he's begging me to come back, please help me stay gone. ",sabai_dee_mai,45,50,https://www.reddit.com/r/abusiverelationships/comments/1hu24bh/i_just_left_and_hes_begging_me_to_come_back/,"Please I packed all my stuff, I told him even before I left, I'm in my car it's been 2 hours. I drove a short distance away. 

He is calling and texting saying we can't give up on this, that I'm being emotional, that I just need to come back and talk. That he will do everything I want. That I just have to also change the way I speak to him. 

He's saying he loves me and no relationship is perfect. 

Please help me leave
",2025-01-05 08:48:33,2025-03-17 03:27:30,help
1g7n28u,Why doesn’t anyone help a woman getting abused in public?,IntroductionOk7954,65,61,https://www.reddit.com/r/abusiverelationships/comments/1g7n28u/why_doesnt_anyone_help_a_woman_getting_abused_in/,"I noticed a lot of people saying the opposite and that people won't help a man getting abused in public but many times my ex attacked me in public we either got kicked out of the store where he was following me and wouldn't leave me alone. Grabbing me and taking my stuff tryint to break my phone. People even just walk away. Today he ripped up and broke all my belongings emptied out my wallet and wouldn't give it back. He was gaslighting me and pretending I was on drugs in public when I was trying to get away from him, grabbing me and making me fall. Today a man got out of his car and stood there to see if it would go any further thank god but usually people just ignored it. I am away from him now but this world is so disgusting it's hard to want to live in it. So many men get away with domestic violence against women. The police target thieves stealing a bag of chips more than men abusing women.",2024-10-20 00:45:47,2025-03-17 03:27:31,help
19fcj17,"Need help, I feel like I'm losing my mind",bluefolder7776,136,103,https://www.reddit.com/gallery/19fcj17,"I honestly feel like I'm losing my mind. 

This conversation combined with my mother basically saying I shouldn't leave now because he hasn't physically abused me in 6 months even though he has verbally. He told me that his support people are acting like it's ridiculous that I'm leaving now because he hasn't hit me in 6 months. He's telling me I am trying to change him and that's not love because I told him the only way I would stay is if he went to a IPV program. 

Did he already change and I'm leaving from resentment or is it just a waiting period before it happens again? Should I stay? I'm so confused.",2024-01-25 15:56:39,2025-03-17 03:27:33,help
1h21vik,I am devastated none of his friends believe me. They all think I’m lying or they think we are “both victims” despite how much worse he put me through. How do I get over this? How do people not care when their friends abuse someone? Thanksgiving feels heartbreaking right now. I’m sorry I need help. ,mysteryfairylove,58,50,https://www.reddit.com/gallery/1h21vik,"I’m devastated that none of his friends believe me. They all think I’m lying or they think we are “both victims” despite how much worse he put me through. How do I get over this? Why do people not care about when their friends abuse someone? Thanksgiving feels heartbreaking right now. 
",2024-11-28 18:04:04,2025-03-17 03:27:34,help
1j0469x,guys i’m getting her arrested pls help me not feel guilty,ashysodapuppy,33,31,https://www.reddit.com/r/abusiverelationships/comments/1j0469x/guys_im_getting_her_arrested_pls_help_me_not_feel/,"it’s 3am, i have work at 9am, she blacked my eye. I called the police and want her arrested but i’m also scared, and feel guilty doing it. Pls validate me guys, i’m so scared and alone rn, i have no family, no friends to call, I just need to know i’m doing the right thing!! ",2025-02-28 09:52:08,2025-03-17 03:27:36,help
r9j9ki,What an abusive relationship looks like through texts from my ex. Sharing these helps me justify moving on.,helloimcold,389,134,https://www.reddit.com/gallery/r9j9ki,,2021-12-05 16:28:10,2025-03-17 03:27:38,help
1i0o8k7,Did someone say something to help you realize you were being abused?,Calm_Sea6505,19,41,https://www.reddit.com/r/abusiverelationships/comments/1i0o8k7/did_someone_say_something_to_help_you_realize_you/,"I realize that people have to realize in their own time but…for those of you who were in an abusive relationship, is there anything that someone said to you to make it “click”, or at least plant the seed that things were not ok? 

Edit for a little more context..my brother recently proposed to his abusive gf and plans to quickly marry and then move far from our family. We fear that once he isolates himself with her that his life will be ruined and we’ll never see him again.",2025-01-13 20:49:43,2025-03-17 03:28:38,help
1igjbn0,Please help I need advice on my situation,Wasabi-lover,43,32,https://i.redd.it/kza1cqr6hvge1.jpeg,If you can please read my other post on Reddit it ties in with this situation. I have been dating my ex for a year and he’s been violent with me multiple times about 6 of 7 times now he’s hit me in the face or anywhere on my body while we were arguing. After the last post I made I decided to let him back into my life and about 3 weeks later it happened again…. We got into an argument because he wouldn’t leave my apartment after making rude remarks towards me after drinking. He’s been off and on staying with me since I couldn’t make up my mind on whether or not I wanted to be with him after the last time he hit me. It was pretty recent so I’ve been distance with him and my energy was different. I tried to break up with him tonight and make him pack his stuff but he refused to leave so I cried and begged him for over an hour. I ended up throwing some legos at my couch where he was sitting then he threw another set and hit me right in the face slamming me on the floor sitting me again putting my arms behind my back with all his weight on me so I’m screaming telling him to get off of me and that I couldn’t breathe. After I ran away I looked at myself in the mirror and noticed my bloody mouth and bruised forehead so I went into my room and pulled out my gun. It was unloaded so I pointed it at him telling him he needed to leave because I did not want him to attack me again. After he left I texted the police asking for assistance and they came and took pictures of my face. They arrested him while he was driving in the area but I just want to know if I’m in the wrong here. I am completely terrified he will use the gun against me but I was never going to shoot it I just wanted him out of my place. I am spiraling and can’t even think straight and can’t even comprehend anything that happened. My heart is completely shattered and I can’t stop crying. Add pics below ,2025-02-03 06:59:14,2025-03-17 03:28:40,help
1gqa5mj,Please help remind me that this was the right decision,Dry-Painting4629,28,52,https://www.reddit.com/gallery/1gqa5mj,"Tonight, I ended up bawling in my bed all of a sudden because Im so torn between losing her and choosing me. I recognize the pattern at play here: I keep trying to get someone I love to see me but I’m met with only contempt. This is how my mother had treated me whenever I tried to open up to her about my feelings. My childhood needs were always met in terms of housing and food, but emotionally… my brother and I were neglected. 

I just can’t do it anymore. My mental health has seriously declined since meeting her but therapy has been helping set me right back on track. This is much of my ex and i’s last conversation and I stopped speaking to her last week. I miss her and I don’t really know why when she treated me so poorly. I guess my brain really is messed up and I’m here asking for reminders to keep the boundary and that this was the right decision for us both. Feel free to share similar stories. Thank you.",2024-11-13 10:45:34,2025-03-17 03:28:41,help
1ghccnl,Help. I just don't know what to do,Weirdquestions_,38,52,https://www.reddit.com/gallery/1ghccnl,"I broke up with him last week, we talked on the phone 4 days ago even tho I didn't want to. ",2024-11-01 18:29:46,2025-03-17 03:28:43,help
wsl1h3,"It takes 10 positives to outweigh a negative. I got so many encouraging comments yesterday, telling me I was doing the right thing leaving my abusive husband. I have been reading every reply over and over. Your words are so helpful. Then I get a message like this and I doubt myself. Y do I do this?",TryingtoImprove7,252,136,https://i.redd.it/xu16v1yvppi91.jpg,,2022-08-19 18:21:28,2025-03-17 03:28:45,help
x5pa5q,Please help me rationalize what happened last night. He had a huge fight because I went to a bridal shower. He grabbed some clothes and went to stay at his moms house,Icy_Abbreviations277,169,158,https://www.reddit.com/gallery/x5pa5q,,2022-09-04 15:10:59,2025-03-17 03:28:47,help
1iyhih7,Please help me realize I need to leave him. I feel bad because of our cat.,sadgirlbabydoll,7,26,https://www.reddit.com/r/abusiverelationships/comments/1iyhih7/please_help_me_realize_i_need_to_leave_him_i_feel/,"Okay so I am planning on leaving my boyfriend. But I feel bad because the cat really likes him… I will be taking the cat with me. But I feel bad just up and leaving him… 

I HATE how I feel bad. He has hit the cat before because the cat accidentally knocked over a drink! So I am definitely not leaving the cat with him, but I feel bad because the cat likes him a lot. 

I am sick of feeling bad. He is a piece of crap. I just wish this was easy… I need help. I should feel bad for myself!!! Sorry that this is all over the place. I’m kind of all over the place right now. ☹️",2025-02-26 06:47:50,2025-03-17 03:28:48,help
1izqb6f,Am I being abused? Need help.,Much_Education83,8,24,https://www.reddit.com/r/abusiverelationships/comments/1izqb6f/am_i_being_abused_need_help/,"Hi there. I (M36) am concerned my partner (F35) is verbally and mentally abusive, but I keep going back and forth on it. I just need a way to find out for sure. FWIW, my long-term therapist says I am certainly being abused, but I don't really have any friends, so he is the only person I've ever discussed this with. I go back and forth on this, but I’d really like to hear from others who’ve been through something similar. Am I overreacting? Or is this as serious as it feels? I guess I'll give some anecdotes below and see what you think? These incidents are only a small sample—this has been a pattern for years, not just a handful of bad moments.

We've been together for 13 years and have known each other for 6 years before that. It was my first relationship, her second. Of course, everything started well. Honestly, the first 4 years or so were good/okay. Around year 6, in response to her volatile temper and our lack of a sex life (that she blamed on me, though this wasn't the case) I tried to end the relationship, asking for a break. After the 2 week break she cried a lot and we got back together.

We briefly did couples therapy after this and things were good for quite a while. Over the last 4 years or so things have gotten really bad. 

The most pervasive thing is her anger and opinion of me. She gets mad at me about anything and everything; chewing too loud, the loudness of my shoes on wood floors, being too slow to get out of her way when she walks around, etc. These small things have added up over time and I felt beat down, so I started trying to do things that I found fun, outside of time with her. She didn't like this. For example, I started running D&D games at a game store (1 day every 2 weeks), took a weekend German class (once a week), attending Comic-Con (she isn't interested in going) and eventually started a small business turning my passion into an income. She has not been supportive of any of these things, often telling me how selfish I am to do them. She makes endless small comments about how selfish I am and how hurtful she finds it that I do these things. She's also had some wild ideas around them, such as saying I'm not actually going to D&D, instead I'm going to the house of one of my players who's gay to sleep with him. Wild things.

Finally, the most serious things. We get into terrible arguments sometimes that start out of absolute nowhere and become all encompassing. It usually starts with her getting mad about something small and then claiming that I'm doing these things on purpose, that I don't understand her, that she's only mad cause I'm doing these things, etc. She gets very mentally nimble during an argument, twisting my words and making me feel confused and unsure of reality*.* These arguments often end with her screaming at me and calling me names (coward, p\*\*\*y, f\*\*\*ing idiot, stupid, telling me to shut up, etc). The pattern is then that I go take space and then she gets mad about this, claiming I should just talk things through with her, etc.

I'll give one somewhat detailed incident, though, as I write this I feel like I'm not presenting my experience very well. A few weeks ago one morning we fooled around for a while and it ended poorly (she gets very uncomfortable with sex). This was fine and I tried to be supportive. She then got very mad wondering why I was doing this when she wasn't interested (this was not the case! She was interested until the second she was not). She then got angry that the wasted time was going to result in us missing an event we were trying to go to. I said ya, some time has gone by, but let's give it a go! (it was only 10am and the event was all day). This is when things devolved and turned to me being confused and her yelling and name calling. She then declared she was leaving, going to the event on her own. Confused, I asked why she was doing that, can't we talk? She told me to get in the car if I want to talk, she's not waiting. I told her that didn't feel safe given how angry she was. She then left.

I texted her shortly after telling her I was going to take space for the rest of the day and I'd reach back out tomorrow. I was feeling really uncomfortable, anxious and scared. She then texted and called me non-stop for about 2 hours. The texts were awful and mean, full of cussing and name calling and making it seem like I was in the wrong. She called me literally 36 times in a row. I kept texting her to please leave me alone, I will reach out when I'm ready. I told her she was scaring me. She didn't stop.

We've been on a knife's edge ever since this incident. Currently she's acting very kind because I told her next time she did something like that I'd leave her. However, she's made minimizing comments about the boundaries I've set too, like ""Oh, well I guess I can't say that anymore.""

Anyway, I hope any of this makes sense. I didn't realize until now how poorly I'm able to communicate these things. I feel lost. If anyone has been in a similar situation, how did you handle it? Does this actually sound abusive to you? She's not like this all the time. I don’t know what to do next, and I’d really appreciate any advice.",2025-02-27 20:58:44,2025-03-17 03:28:50,help
1g5kmbh,Was this abuse? Please help.,effy217,17,47,https://www.reddit.com/gallery/1g5kmbh,"I’m sorry but I had to put my story in using pictures. Something I may have missed is that one time whilst he was living with his mother, she had to call the cops on him because he started raging at her. She had asked him to clean up the wood shavings from her garage (he wanted to start a carpentry business, which I helped him to set up, bought the LLC etc.), and he refused because it would “just get messy again the next day”. She then had to leave the kitchen as it got too much for her and he started walking around her kitchen and literally spitting on everything, like counters etc. I told him from the other end of the phone to calm down.. 
He has also threatened to burn his father’s ranch down as he was selling it and wouldn’t be getting a share. Always complained how his family wouldn’t help him, being homeless and living in his car. He owes me $800 that I gave him to buy food and weed. Not sure if I mentioned that. 
Anyways, I’m just really looking for advice. He has since blocked me on everything and I feel like I have brain damage. I’m on antidepressants. Not doing very well. Can’t access therapy. Quite suicidal.
I just really need validation that this was not my fault and that I didn’t deserve it.",2024-10-17 06:32:44,2025-03-17 03:28:51,help
1j4k4r7,this sub has helped me so much,Sea_Strength_533,34,16,https://www.reddit.com/r/abusiverelationships/comments/1j4k4r7/this_sub_has_helped_me_so_much/,"i have been following this sub for many months, although i have made many new accounts and deleted most of my posts out of fear of him finding me. 

i just want to say how much this sub, and everyone here, has saved my life. i joined while i was still with my ex, and at that time i felt so confused about if he was abusive or if i was the abuser. anytime i tried to post, i would delete it because i was scared of the answer. now i’ve been out of that relationship for exactly 31 days and my life has completely changed. i’m still scared to give too many details but i just want to say thank you so much to everybody for being part of this community. i scroll through it every day to serve as a reminder of why i left, and i read every single post. literally every single one reminds me of him. isn’t it crazy how they all act/talk exactly the same??

for anyone out there who is thinking about leaving, or who isn’t sure what to do yet, or who doesn’t want to leave, just know that you are so much stronger and more capable than you know. it took me 7 years, and i really thought i would just deal with it forever because i was too scared to make a decision. but fuck that. we all deserve better! 

also, read Why Does He Do That by Lundy Bancroft. it gets recommended 20x a day in this sub because it’s no joke. the first few chapters literally changed my brain chemistry

https://tu.tv/wp-content/uploads/2021/01/why-does-he-do-that.pdf",2025-03-06 01:39:45,2025-03-17 03:28:53,help
1fizwef,My grandpa was being inappropriate this morning (help),Different_Minute_275,7,52,https://www.reddit.com/r/abusiverelationships/comments/1fizwef/my_grandpa_was_being_inappropriate_this_morning/,I’m 16 and I was going downstairs to get something to eat and my grandpa is sick and I’m still a bit sick too he was quiet so I looked to see if he was asleep on the couch but what I saw shocked me. He had his boxers all the way down and he was whacking off. I quickly went to the kitchen as if I saw nothing (I didn’t see much but I knew) and I shakily made a sandwich and hesitated going back through the house to get upstairs. He was in the living room and I have to go through there to get upstairs.,2024-09-17 13:55:40,2025-03-17 03:28:54,help
